<?xml version="1.0" encoding="UTF-8" ?>
<!--
  #%L
  settings4j
  ===============================================================
  Copyright (C) 2008 - 2015 Brabenetz Harald, Austria
  ===============================================================
  Licensed under the Apache License, Version 2.0 (the "License");
  you may not use this file except in compliance with the License.
  You may obtain a copy of the License at
  
       http://www.apache.org/licenses/LICENSE-2.0
  
  Unless required by applicable law or agreed to in writing, software
  distributed under the License is distributed on an "AS IS" BASIS,
  WITHOUT WARRANTIES OR CONDITIONS OF ANY KIND, either express or implied.
  See the License for the specific language governing permissions and
  limitations under the License.
  #L%
  -->
<!DOCTYPE settings4j:configuration PUBLIC "settings4j.dtd" "http://settings4j.org/archiv/2.0.1/XMLSchema/settings4j.dtd">
<settings4j:configuration xmlns:settings4j='http://settings4j.org/'>

  <connector name="FSConnector" class="org.settings4j.connector.FSConnector" cached="true">
    <param name="rootFolderPath" value="target/test/Settings4jUnittest" />
    <contentResolver-ref ref="ClasspathContentResolver" />
    <objectResolver-ref ref="JavaXMLBeansObjectResolver" />
  </connector>

  <connector name="ClasspathConnector" class="org.settings4j.connector.ClasspathConnector" />

  <contentResolver name="ClasspathContentResolver" class="org.settings4j.contentresolver.ClasspathContentResolver">
  </contentResolver>

  <objectResolver name="JavaXMLBeansObjectResolver" class="org.settings4j.objectresolver.JavaXMLBeansObjectResolver">
  </objectResolver>
</settings4j:configuration>
